{
  "experiment_spec_version": "v1",
  "name": "btc-usd-longer-research-v1",
  "candle_manifest_uri": "s3a://crypto-data/analytics/market_candles/v1/manifests/044a9b0a27414f1e9a39910df240bae0d8eb4eeb39aa5bde53f14ef7f3f9aaab/manifest.json",
  "candle_manifest_sha256": "26e3cc44d90911125908e388487a6160bce0d34094444bafbd9bff3fe3da65c1",
  "exchange": "coinbase",
  "symbol": "BTC-USD",
  "starting_cash": "10000",
  "fee_bps": "40",
  "slippage_bps": "5",
  "ranges": {
    "train": {"start": "2026-06-10T00:00:00Z", "end": "2026-08-09T00:00:00Z"},
    "validation": {"start": "2026-08-09T00:00:00Z", "end": "2026-08-24T00:00:00Z"},
    "test": {"start": "2026-08-24T00:00:00Z", "end": "2026-09-08T00:00:00Z"}
  },
  "candidates": [
    {"candidate_id": "sma-5-20", "fast_period": 5, "slow_period": 20},
    {"candidate_id": "sma-15-60", "fast_period": 15, "slow_period": 60},
    {"candidate_id": "sma-60-240", "fast_period": 60, "slow_period": 240}
  ],
  "selection_policy": {
    "minimum_train_fills": 1,
    "maximum_train_drawdown": "0.20",
    "maximum_validation_drawdown": "0.20"
  }
}
