{
  "experiment_spec_version": "v1",
  "name": "btc-usd-historical-readiness-v1",
  "candle_manifest_uri": "s3a://crypto-data/analytics/historical_candles/v1/manifests/178b044cef946af509c7d9b97245d0ac0884787747e673ab99acd6bd6b47f7b3/manifest.json",
  "candle_manifest_sha256": "0463be6b320b4ba207c65aebf01dab2d4a3ff2e275a227dd6c67d4c259ca1072",
  "exchange": "coinbase",
  "symbol": "BTC-USD",
  "starting_cash": "10000",
  "fee_bps": "40",
  "slippage_bps": "5",
  "ranges": {
    "train": {"start": "2026-06-10T00:00:00Z", "end": "2026-08-09T00:00:00Z"},
    "validation": {"start": "2026-08-09T00:00:00Z", "end": "2026-08-24T00:00:00Z"},
    "test": {"start": "2026-08-24T00:00:00Z", "end": "2026-09-08T00:00:00Z"}
  },
  "candidates": [
    {"candidate_id": "sma-5-20", "fast_period": 5, "slow_period": 20},
    {"candidate_id": "sma-15-60", "fast_period": 15, "slow_period": 60},
    {"candidate_id": "sma-60-240", "fast_period": 60, "slow_period": 240}
  ],
  "selection_policy": {
    "minimum_train_fills": 1,
    "maximum_train_drawdown": "0.20",
    "maximum_validation_drawdown": "0.20"
  }
}
